id,name,type1292288,Citizen Kane, 剧情 悬疑1297294,Vertigo, 爱情 悬疑 惊悚1292226,2001: A Space Odyssey, 科幻 惊悚 冒险1291568,Tokyo Story, 剧情 家庭1291841,The Godfather, 剧情 犯罪1361276,Eight and a Half, 剧情 奇幻1401261,La r, 剧情 喜剧1295753,Sunrise: A Song of Two Humans, 剧情 爱情1292668,The Searchers, 剧情 西部 冒险1295399,The Seven Samurai, 剧情 动作 冒险1292260,Apocalypse Now, 剧情 战争1293460,Singin' in the Rain, 喜剧 爱情 歌舞1295873,Ladri di biciclette, 剧情 犯罪1293492,Battleship Potemkin, 剧情 历史 战争1292222,Taxi Driver, 剧情 犯罪1353745,bout de souffle, 剧情 爱情 犯罪1293783,La passion de Jeanne d'Arc, 剧情 传记 历史 犯罪1299433,L'Atalante, 剧情 爱情1294438,Persona, 剧情1291879,Rashomon, 剧情 悬疑 犯罪1293199,Man with a Movie Camera, 纪录片1299131,2 The Godfather: Part, 剧情 犯罪1300056,Les quatre cents coups, 剧情 犯罪1293155,Raging Bull, 剧情 传记 运动1293181,Psycho, 悬疑 惊悚 恐怖1293908,City Lights, 剧情 喜剧 爱情1298248,Andrey Rublyov, 剧情 传记 历史 战争1292574,Some Like It Hot, 喜剧1293271,La Dolce Vita, 剧情 喜剧1299248,Zerkalo, 剧情 传记 历史 战争1294756,Touch of Evil, 惊悚 犯罪 黑色电影1401619,Au hasard Balthazar, 剧情 犯罪1303566,Ordet, 剧情1298733,Sunset Blvd., 剧情 黑色电影1296753,Casablanca, 剧情 爱情 战争1292349,Lawrence of Arabia, 剧情 传记 冒险1389923,L'avventura, 剧情 悬疑1291839,Blade Runner, 科幻 惊悚1303555,Le m, 剧情 爱情1292778,The General, 剧情 喜剧 动作 战争 冒险1299080,Rear Window, 悬疑 惊悚1294808,La Grande Illusion, 剧情 战争1293582,The Night of the Hunter, 惊悚 犯罪 黑色电影1291557,In the Mood for Love, 剧情 爱情1294371,Modern Times, 剧情 喜剧 爱情1303543,Play Time, 喜剧1303577,Ugetsu Monogatari, 剧情 战争 奇幻1322848,Dr. Strangelove or: How I Learned to Stop Worrying and Love the Bomb, 剧情 喜剧1295451,The Third Man, 悬疑 惊悚 黑色电影1293889,Chinatown, 剧情 悬疑 惊悚 犯罪1292784,Fanny och Alexander, 剧情1295656,Stalker, 剧情 科幻 悬疑1292472,Barry Lyndon, 剧情 爱情 战争1394218,The Apartment, 剧情 喜剧 爱情1306019,Pather Panchali, 剧情1293381,M, 剧情 惊悚 犯罪 黑色电影1298497,Rio Bravo, 剧情 喜剧 爱情 西部1293071,Smultronst, 剧情 爱情 家庭1298107,Metropolis, 剧情 科幻1292217,Mulholland Dr., 剧情 悬疑 惊悚1295872,North by Northwest, 动作 悬疑 犯罪1300375,Les enfants du paradis, 剧情 爱情1292533,Pierrot le fou, 剧情 喜剧 爱情 歌舞 犯罪1303557,Viridiana, 剧情1293394,C'era una volta il West, 剧情 犯罪 西部1296963,The Wild Bunch, 动作 西部1292719,La strada, 剧情1419005,La battaglia di Algeri, 剧情 历史 战争1303328,Shoah, 纪录片 历史 战争1298672,Amarcord, 剧情 喜剧1298817,The Gold Rush, 喜剧 爱情 西部 冒险1293234,Det sjunde inseglet, 剧情 奇幻1303576,Viaggio in Italia, 剧情1293146,Il gattopardo, 剧情 爱情 历史 战争1307265,Banshun, 剧情 家庭1291832,Pulp Fiction, 剧情 喜剧 犯罪1292268,Goodfellas, 剧情 传记 犯罪1299214,The Magnificent Ambersons, 剧情 爱情1292233,A Clockwork Orange, 剧情 科幻 犯罪1293749,It's a Wonderful Life, 剧情 爱情 奇幻1303559,Pickpocket, 剧情 犯罪1300955,Il conformista, 剧情1292338,Jules et Jim, 剧情 爱情1293037,Nashville, 剧情 音乐1303521,Close-Up, 剧情 犯罪1420116,Gertrud, 剧情1303562,Un Condamn, 剧情 惊悚 战争1296987,Annie Hall, 剧情 喜剧 爱情1295134,The Man Who Shot Liberty Valance, 剧情 爱情 西部1294941,Jaws, 剧情 惊悚 冒险1303573,Sansho the Bailiff, 剧情1301923,Greed, 剧情1400240,L'ann, 剧情 爱情 悬疑1868933,"Jeanne Dielman, 23 Quai du Commerce, 1080 Bruxelles", 剧情1292225,The Shining, 剧情 悬疑 恐怖1293525,A Woman Under the Influence, 剧情 爱情1306002,"Aguirre, der Zorn Gottes", 剧情 传记 历史 冒险1310176,Blow-Up, 剧情 悬疑 惊悚1401901,Sans soleil, 纪录片1292262,Once Upon a Time in America, 剧情 犯罪1303418,To Be or Not to Be, 喜剧 战争1422088,S, 剧情 悬疑1295287,Intolerance: Love's Struggle Throughout the Ages, 剧情 爱情 历史1292625,The Wizard of Oz, 歌舞 奇幻 冒险1293105,L'eclisse, 剧情 爱情1302050,Hiroshima mon amour, 剧情 爱情 战争1295252,La maman et la putain, 剧情1300267,Gone with the Wind, 剧情 爱情 历史 战争1306626,La jet, 剧情 爱情 科幻 短片1294300,Manhattan, 剧情 喜剧 爱情1293847,To Live, 剧情1401900,El esp, 剧情1292224,One Flew Over the Cuckoo's Nest, 剧情1293838,Star Wars, 动作 科幻 冒险1401385,All About Eve, 剧情1301122,Madame de..., 剧情 爱情1303408,Sherlock Jr., 喜剧 奇幻1294638,E.T., 剧情 科幻1297657,Bringing Up Baby, 喜剧 爱情1299733,My Darling Clementine, 剧情 西部1297228,Letter from an Unknown Woman, 剧情 爱情 音乐1292329,A Brighter Summer Day, 剧情 犯罪1296669,"Roma, citt", 剧情 战争1401585,Partie de campagne, 剧情 爱情 短片1293667,L', 喜剧1292434,Yi yi, 剧情 爱情 家庭1303579,Los Olvidados, 剧情 犯罪1300868,Alien, 科幻 恐怖1302294,Don't Look Now, 剧情 悬疑 恐怖1296757,Vivre sa vie: Film en douze tableaux, 剧情1297422,Badlands, 剧情 爱情 惊悚 犯罪1296791,"Nosferatu, eine Symphonie des Grauens", 恐怖 奇幻1300766,Notorious, 剧情 爱情 惊悚1294092,Angst essen Seele auf, 剧情 爱情1297546,Professione: reporter, 剧情 惊悚1293958,Do the Right Thing, 喜剧1298134,Stagecoach, 剧情 动作 爱情 西部1298962,Un chien andalou, 短片 奇幻1293852,Rosemary's Baby, 剧情 悬疑 恐怖1422186,Come And See, 剧情 战争1299411,A Matter of Life and Death, 剧情 爱情 战争 奇幻1303415,The Lady Eve, 喜剧 爱情 犯罪1296908,The Conversation, 剧情 悬疑 惊悚1299775,Il vangelo secondo Matteo, 剧情 传记 历史1303556,El, 剧情 喜剧 悬疑 奇幻1298113,Duck Soup, 喜剧 歌舞1299231,His Girl Friday, 剧情 喜剧 爱情1293232,Days of Heaven, 剧情 爱情1293226,Double Indemnity, 惊悚 犯罪 黑色电影1294364,Brief Encounter, 剧情 爱情1294746,Trouble in Paradise, 喜剧 爱情 犯罪1292521,On the Waterfront, 剧情 爱情 犯罪1306791,Beau travail, 剧情 同性1439723,-1A, 纪录片1296147,Viskningar och rop, 剧情 爱情1323746,Spring in a Small Town, 剧情 爱情1401118,"Il buono, il brutto, il cattivo.", 西部 冒险1422308,Campanadas a medianoche, 剧情 喜剧 战争1303364,Le charme discret de la bourgeoisie, 剧情 喜剧 奇幻1298593,King Kong, 动作 奇幻 冒险1292403,The Deer Hunter, 剧情 战争1303536,L'argent, 剧情 犯罪1299204,The Red Shoes, 剧情 爱情 音乐1416677,The River, 剧情 爱情1292733,Black Narcissus, 剧情1474748,Earth, 剧情1302413,Mouchette, 剧情1295646,The Great Dictator, 剧情 喜剧 战争1303558,Rocco e i suoi fratelli, 剧情 犯罪1294625,Imitation of Life, 剧情 爱情1401756,Napol, 剧情 传记 历史 战争1301646,Les parapluies de Cherbourg, 剧情 爱情 歌舞1292465,The Grapes of Wrath, 剧情1301252,Dekalog, 剧情1310175,The Birds, 悬疑 惊悚 灾难1307639,Der letzte Mann, 剧情1945780,There Will Be Blood, 剧情1295759,The Travelling Players, 剧情 历史 战争1299816,The Life and Death of Colonel Blimp, 剧情 爱情 战争1300912,Morte a Venezia, 剧情 同性1293823,Brazil, 剧情 科幻1296097,Umberto D., 剧情1301649,Belle de jour, 剧情 情色1302338,Out of the Past, 剧情 惊悚 黑色电影1294781,Le notti di Cabiria, 剧情 爱情1291561,Spirited Away, 剧情 动画 奇幻1295757,The Quiet Man, 剧情 喜剧 爱情1300977,Solaris, 剧情 科幻 悬疑1294194,A City of Sadness, 剧情1418141,C, 剧情 喜剧 悬疑 奇幻1298270,Nuit et brouillard, 纪录片 短片 历史 战争1299257,Pais, 剧情 战争1292468,Breaking the Waves, 剧情 爱情1297920,Kes, 剧情1292565,Red River, 动作 西部 冒险1292067,Fargo, 剧情 惊悚 犯罪1300392,The Texas Chain Saw Massacre, 悬疑 恐怖1293818,The Piano, 剧情 爱情 音乐1302808,Sweet Smell of Success, 剧情 黑色电影1296196,Revolt, 剧情 动作 战争1298405,Close Encounters of the Third Kind, 剧情 科幻1294331,Performance, 剧情 音乐 犯罪 奇幻1303174,Popi, 剧情 战争1294100,The Best Years of Our Lives, 剧情 爱情 战争1418426,Deus E o Diabo na Terra do Sol, 剧情 犯罪 西部 冒险1292271,The Graduate, 剧情 喜剧 爱情1292547,Das Cabinet des Dr. Caligari, 悬疑 恐怖 犯罪1296621,Wavelength, 剧情 短片1300966,Le samoura, 剧情 悬疑 惊悚 犯罪1292781,The Thin Red Line, 剧情 战争1300964,2 ou 3 choses que je sais d'elle, 剧情 喜剧1291999,Chungking Express, 剧情 爱情1292504,Der Himmel, 剧情 爱情 奇幻1438066,Cach, 剧情 悬疑 惊悚1474367,"Ivan the Terrible, Part Two", 传记 历史1292735,Nanook of the North, 纪录片1300044,The Big Lebowski, 喜剧 犯罪1296717,Raiders of the Lost Ark, 动作 冒险1293755,The Exorcist, 恐怖1295124,Schindler's List, 剧情 历史 战争1308777,Eternal Sunshine of the Spotless Mind, 剧情 爱情 奇幻1300712,Only Angels Have Wings, 剧情 爱情 冒险1293950,McCabe & Mrs. Miller, 剧情 西部1293153,Germania anno zero, 剧情 战争1295995,Kind Hearts and Coronets, 喜剧 犯罪1303416,Sullivan's Travels, 剧情 喜剧 爱情 冒险1300749,Vampyr - Der Traum des Allan Grey, 恐怖 奇幻1401618,Journal d'un cur, 剧情 悬疑1302061,"Paris, Texas", 剧情1295445,Meet Me in St. Louis, 爱情 歌舞 家庭1303542,Sayat Nova, 剧情 音乐 传记1293273,The Crowd, 剧情 爱情1292516,The Treasure of the Sierra Madre, 剧情 动作 西部 冒险1293566,Unforgiven, 剧情 西部1361252,La Notte, 剧情 爱情1294518,Z, 剧情 喜剧 短片2336735,The Tree of Life, 剧情 家庭 奇幻1300613,Groundhog Day, 剧情 喜剧 爱情 奇幻1440610,V, 纪录片1294584,Bonnie and Clyde, 动作 传记 犯罪1292969,Paths of Glory, 剧情 战争1296577,Tabu: A Story of the South Seas, 剧情 爱情 冒险1484154,Memorias del subdesarrollo, 剧情1850003,The Band Wagon, 喜剧 爱情 歌舞 家庭1303603,Saikaku ichidai onna, 剧情1485059,El Verdugo, 剧情 喜剧1291560,Tonari no Totoro, 动画 奇幻 冒险1303575,Johnny Guitar, 西部1293564,Magnolia, 剧情1414808,Tropical Malady, 剧情 爱情 同性 奇幻1298870,Ukigumo, 剧情 爱情1293329,The Story of the Last Chrysanthemums, 剧情1437390,Meshes of the Afternoon, 短片1293511,Mean Streets, 剧情 犯罪1299166,The Shop Around the Corner, 剧情 喜剧 爱情1295942,Freaks, 剧情 恐怖1298182,"Ivan the Terrible, Part One", 传记 历史1302923,In a Lonely Place, 剧情 爱情 悬疑 惊悚 黑色电影1292047,Trois couleurs: Rouge, 剧情 爱情 悬疑1298420,Broken Blossoms or The Yellow Man and the Girl, 剧情 爱情1297996,Night of the Living Dead, 悬疑 恐怖1296388,The Thin Blue Line, 纪录片1294827,Throne of Blood, 剧情 惊悚 战争 奇幻1292644,Faces, 剧情1296283,Ma nuit chez Maud, 剧情 爱情1297874,The Maltese Falcon, 悬疑 犯罪 黑色电影1292048,Trois couleurs: Bleu, 剧情 爱情 音乐1299932,Le salaire de la peur, 剧情 惊悚 冒险1303532,Love Streams, 剧情 喜剧1294047,Monsieur Verdoux, 剧情 喜剧 犯罪1305878,"Distant Voices, Still Lives", 剧情1296528,Star Wars: Episode V - The Empire Strikes Back, 动作 科幻 冒险1295913,La belle et la b, 剧情 爱情 奇幻1292536,Crimes and Misdemeanors, 剧情 喜剧1296338,Week End, 剧情 喜剧1293925,Eraserhead, 恐怖 奇幻1401368,Die B, 剧情 爱情 犯罪1303095,Husbands, 剧情1291828,Nuovo Cinema Paradiso, 剧情 爱情1437023,Im Lauf der Zeit, 剧情1305896,Vredens dag, 剧情 爱情 恐怖1791033,Terra em Transe, 剧情1305790,Les vacances de Monsieur Hulot, 喜剧1296794,The Thing, 科幻 悬疑 恐怖1300306,The Birth of a Nation, 剧情 爱情 历史 战争 西部1292206,Underground, 剧情 战争1301897,, 剧情1291843,The Matrix, 动作 科幻1294433,An Autumn Afternoon, 剧情 家庭1295276,Videodrome, 科幻 悬疑 惊悚 恐怖1296282,Cabaret, 剧情 爱情 歌舞1424576,Touki Bouki, 剧情1440613,Jalsaghar, 剧情 音乐1293352,The Big Sleep, 悬疑 惊悚 犯罪 黑色电影1294531,Offret, 剧情1293270,The Kid, 剧情 喜剧 家庭1303494,Killer of Sheep, 剧情1302941,Puppetmaster, 剧情 传记 战争1295720,Apur Sansar, 剧情1300555,Back to the Future, 喜剧 科幻 冒险1293095,This Is Spinal Tap, 喜剧 音乐1292840,The Philadelphia Story, 喜剧 爱情1295943,A Canterbury Tale, 剧情 喜剧 悬疑 战争1291937,Todo sobre mi madre, 剧情1292812,Harold and Maude, 剧情 喜剧1300572,The Time to Live and the Time to Die, 剧情 家庭 传记1292208,Cidade de Deus, 剧情 犯罪1299665,Peeping Tom, 剧情 惊悚 犯罪1300660,Berlin Alexanderplatz, 剧情1297756,Snow White and the Seven Dwarfs, 爱情 动画 歌舞 家庭 奇幻1299603,Reservoir Dogs, 惊悚 犯罪1295578,Dawn of the Dead, 动作 恐怖1298026,The Last Picture Show, 剧情1299261,Il deserto rosso, 剧情1303723,Stranger Than Paradise, 剧情 喜剧1295225,West Side Story, 剧情 爱情 歌舞 犯罪1302017,Make Way for Tomorrow, 剧情1436764,Orph, 剧情 爱情 奇幻1306490,A Touch of Zen, 剧情 动作 武侠 古装1293374,Dog Day Afternoon, 剧情 喜剧 犯罪1297991,To Kill a Mockingbird, 剧情 悬疑 犯罪1303569,Kiss Me Deadly, 剧情 惊悚 犯罪 黑色电影1293322,How Green Was My Valley, 剧情 家庭1297628,Midnight Cowboy, 剧情1302012,Bride of Frankenstein, 科幻 恐怖1295686,Heat, 剧情 动作 惊悚 犯罪1293399,Amadeus, 剧情 音乐 传记1295684,It Happened One Night, 喜剧 爱情1298759,Dogville, 剧情 悬疑 惊悚1499492,The House Is Black, 纪录片 短片1401529,El sol del membrillo, 剧情 纪录片 传记1401612,Salvatore Giuliano, 剧情 悬疑 历史 战争 犯罪1297130,Teorema, 剧情 悬疑 情色1304310,Le voyage dans la lune, 科幻 短片 奇幻 冒险1303459,Lost Highway, 剧情 悬疑 惊悚1294421,Ivanovo detstvo, 剧情 战争1291877,La double vie de V, 剧情 爱情 奇幻1303417,The Palm Beach Story, 喜剧 爱情1292679,Happy Together, 剧情 爱情 同性1416898,Werckmeister harm, 剧情 悬疑1294252,Landscape in the Mist, 剧情1295812,Suna no onna, 剧情 惊悚1296332,Suspiria, 恐怖1291556,Nostalghia, 剧情1302279,Russian Ark, 剧情 历史 奇幻1301648,Les Demoiselles de Rochefort, 剧情 喜剧 歌舞1293320,An Affair to Remember, 剧情 喜剧 爱情1292772,The King of Comedy, 剧情 喜剧 犯罪1291876,Yellow Earth, 剧情 音乐1294958,The Bridge on the River Kwai, 剧情 历史 战争1292908,Festen, 剧情1855338,Wanda, 剧情 犯罪1303345,All That Heaven Allows, 剧情 爱情1300323,In einem Jahr mit 13 Monden, 剧情 同性1298095,Tirez sur le pianiste, 剧情 爱情 惊悚 犯罪1297602,Butch Cassidy and the Sundance Kid, 剧情 犯罪 西部 冒险1309215,Tie Xi Qu: West of the Tracks - Part 1: Rust, 纪录片1293200,The Elephant Man, 剧情 传记1293544,The Silence of the Lambs, 剧情 惊悚 犯罪1785241,Vidas Secas, 剧情1293663,Tengoku to jigoku, 剧情 犯罪1300956,Novecento, 剧情 爱情 历史 战争1300353,Ultimo tango a Parigi, 剧情 爱情 情色1307973,If...., 剧情2131459,WALL, 科幻 动画 冒险1294825,The Innocents, 惊悚 恐怖1418834,Brokeback Mountain, 剧情 爱情 同性 家庭1292981,Scener ur ett, 剧情 爱情1296500,Sedmikr, 剧情 喜剧1292664,Carrie, 剧情 恐怖1293299,La nuit am, 剧情 喜剧 爱情1292768,Opening Night, 剧情1299517,The Hustler, 剧情 爱情 运动1401595,"Las Hurdes, tierra sin pan", 纪录片 短片1292515,The Bodyguard, 剧情 动作 惊悚 犯罪1301655,Tristana, 剧情1305223,Dont Look Back, 纪录片 音乐1466419,L'arm, 剧情 战争1308333,I Know Where I'm Going!, 剧情 爱情1291850,Platform, 剧情 历史1292881,Life of Brian, 喜剧1297531,Network, 剧情1460605,Meghe Dhaka Tara, 剧情1298192,Five Easy Pieces, 剧情1297549,The Cameraman, 剧情 喜剧 爱情 家庭1293323,Raise The Red Lantern, 剧情1301168,"Crouching Tiger, Hidden Dragon", 剧情 爱情 武侠1297105,Fitzcarraldo, 剧情 传记 冒险1468782,Charulata, 剧情 爱情1297646,Easy Rider, 剧情1303150,Man of Aran, 纪录片1400829,Mon Oncle, 喜剧1300211,Punch-Drunk Love, 剧情 喜剧 爱情3285632,A Torin, 剧情1420238,Nun va Goldoon, 剧情 喜剧 爱情1292052,The Shawshank Redemption, 剧情 犯罪1295905,Heaven's Gate, 剧情 历史 西部1477852,"Out 1, noli me tangere", 剧情 喜剧 惊悚1303081,Ostre sledovan, 剧情 喜剧 战争1299236,The Long Goodbye, 剧情 悬疑 惊悚 犯罪2464346,Das wei, 剧情 悬疑1295619,A Star Is Born, 剧情 爱情 歌舞1295167,Shadows, 剧情1868546,Two-lane Blacktop, 剧情1769364,Moartea domnului L, 剧情1293074,French Cancan, 剧情 喜剧 爱情 歌舞1293297,Dead Ringers, 剧情 爱情 惊悚1302077,Letyat zhuravli, 剧情 爱情 战争4280102,Loong Boonmee raleuk chat, 剧情 奇幻1848300,Le plaisir, 剧情 喜剧1297918,The Awful Truth, 喜剧 爱情1292000,Fight Club, 剧情 动作 悬疑 惊悚1303529,The Dead, 剧情1292211,Hable con ella, 剧情 爱情1294408,The Sound of Music, 剧情 爱情 歌舞 传记1303572,Senso, 剧情 爱情 历史 战争2245725,Hora de los hornos, 纪录片 历史 战争1301151,Vargtimmen, 剧情 恐怖1300464,Chelsea Girls, 剧情1301279,Les glaneurs et la glaneuse, 纪录片1306266,L'albero degli zoccoli, 剧情 历史1300656,The Terminator, 动作 科幻 惊悚1291835,Lost in Translation, 剧情 爱情1401842,Early Summer, 剧情 家庭1295073,Le chagrin et la piti, 纪录片 历史 战争1298465,The Scarlet Empress, 剧情 爱情 历史1300522,Masculin f, 剧情1298202,Koyaanisqatsi, 纪录片 音乐1294698,To Have and Have Not, 喜剧 爱情 冒险1303451,Flowers of Shanghai, 剧情1301647,Repulsion, 剧情 惊悚1310179,Fantasia, 动画 音乐 奇幻1292757,Pinocchio, 剧情 动画 音乐 奇幻1304857,Withnail & I, 剧情 喜剧1300034,Dersu Uzala, 剧情 冒险1292272,Elephant, 剧情 犯罪1296177,Taste of Cherry, 剧情1437013,Accattone, 剧情1861216,Pyaasa, 剧情 爱情 歌舞1293182,12 Angry Men, 剧情1299586,Halloween, 惊悚 恐怖1900841,Das Leben der Anderen, 剧情 悬疑1303580,"Francesco, giullare di Dio", 剧情 传记 历史1308865,Oldeuboi, 剧情 动作 爱情 悬疑1291575,Toy Story, 喜剧 动画 家庭1297737,Tootsie, 喜剧 爱情1292584,The Lady from Shanghai, 剧情 悬疑 犯罪 黑色电影1303462,Dead Man, 剧情 西部 奇幻1292963,"Steamboat Bill, Jr.", 剧情 喜剧 动作 爱情 家庭1925767,Limite, 剧情1299973,Alexander Nevsky, 剧情 动作 历史 战争1296879,A Night at the Opera, 喜剧 爱情 歌舞1292965,Boogie Nights, 剧情 情色5964718,A Separation, 剧情 家庭1303444,Bad ma ra khahad bord, 剧情1293844,Muriel ou Le temps d'un retour, 剧情1292750,Some Came Running, 剧情 爱情1307994,The Wind, 剧情 西部1293715,All the President's Men, 剧情 惊悚 历史1296591,La caduta degli dei, 剧情 战争1297833,Short Cuts, 剧情 喜剧1294782,Le diable probablement, 剧情1440106,Tini zabutykh predkiv, 剧情 爱情 历史1292767,Shane, 剧情 西部1298043,Barton Fink, 剧情 悬疑 惊悚1294169,East of Eden, 剧情1299330,All That Jazz, 剧情 喜剧 音乐 歌舞1303067,Kagemusha, 剧情 历史 战争1293817,Shadow of a Doubt, 剧情 悬疑 犯罪1292453,2 Mad Max 2, 动作 科幻 惊悚 冒险1294072,Laura, 剧情 爱情 悬疑 黑色电影1298505,Strangers on a Train, 惊悚 犯罪 黑色电影1294377,La terra trema: Episodio del mare, 剧情1421292,Chronique d'un, 纪录片1308422,Safe, 剧情1419271,Gimme Shelter, 纪录片 音乐 历史1293168,Top Hat, 喜剧 爱情 歌舞1389949,Doctor Zhivago, 剧情 爱情 战争1306847,Marketa Lazarov, 剧情 爱情 历史1299077,Naked, 剧情1419111,Grey Gardens, 纪录片1305235,Faust - Eine deutsche Volkssage, 恐怖 奇幻1471815,Lola, 剧情 爱情1296659,Limelight, 剧情 喜剧 爱情 音乐1292720,Forrest Gump, 剧情 爱情1305883,Point Blank, 剧情 惊悚 犯罪1298347,MARGUERITE DURAS, 剧情 爱情1296929,Frankenstein, 科幻 恐怖2043434,The Big Heat, 惊悚 犯罪 黑色电影1297797,Hoop Dreams, 剧情 纪录片 运动1305139,Wagon Master, 剧情 动作 爱情 西部 冒险1295877,S, 剧情 喜剧1292697,Die Hard, 动作 惊悚 犯罪1296792,Nattvardsg, 剧情1303578,Miracolo a Milano, 剧情 喜剧 奇幻1758347,La r, 纪录片1293256,Being There, 剧情 喜剧1302827,Artificial Intelligence: AI, 剧情 科幻 冒险4086853,Melancholia, 剧情 科幻 惊悚1296583,Jeder f, 剧情 传记1303869,Les Vampires, 剧情 动作 悬疑 惊悚 犯罪 冒险1306186,Triumph des Willens, 纪录片 战争1293561,Deliverance, 剧情 惊悚 冒险1432639,Tale of Tales, 动画 短片1316524,"Alphaville, une", 剧情 科幻 悬疑1293230,Die bitteren Tr, 剧情1438734,Inland Empire, 剧情 悬疑 惊悚1297188,Le fant, 剧情 喜剧1300027,Pat Garrett & Billy the Kid, 剧情 历史 西部1295416,Rebel Without a Cause, 剧情 爱情1293306,Alice in den St, 剧情1294848,Providence, 剧情1292764,Hannah and Her Sisters, 剧情 喜剧 爱情1937459,Juventude Em Marcha, 剧情1303546,La prise de pouvoir par Louis XIV, 剧情 历史1306489,Cat People, 悬疑 恐怖1767042,El laberinto del fauno, 剧情 悬疑 战争 奇幻1299539,Picnic at Hanging Rock, 剧情 悬疑 惊悚 恐怖1829859,No Quarto da Vanda, 剧情 纪录片1293484,Hatari!, 剧情 动作 爱情 冒险1299799,Casino, 剧情 传记 犯罪1855271,Bigger Than Life, 剧情1303553,The Servant, 剧情1291546,Farewell My Concubine, 剧情 爱情 同性1857099,No Country for Old Men, 剧情 惊悚 犯罪1300958,Tystnaden, 剧情1294005,Splendor in the Grass, 剧情 爱情1306559,Aparajito, 剧情1292792,My Own Private Idaho, 剧情 爱情 同性1401915,Le cercle rouge, 剧情 惊悚 犯罪2002721,Stellet licht, 剧情1292065,Scarface, 剧情 惊悚 犯罪1291559,Les amants du Pont-Neuf, 剧情 爱情1293936,The Killing, 惊悚 犯罪 黑色电影1295211,Our Hospitality, 喜剧 家庭1292223,Se7en, 剧情 悬疑 惊悚 犯罪1775245,Scorpio Rising, 短片1298471,Shock Corridor, 剧情 悬疑1294477,Secrets & Lies, 剧情 喜剧 家庭1301895,Orlando, 剧情 爱情1296600,Detour, 剧情 犯罪 黑色电影1395036,Salesman, 纪录片1297367,Love Me Tonight, 喜剧 歌舞1303560,Nazar, 剧情1293150,Ben-Hur, 剧情 动作 历史 战争 冒险1306449,La haine, 剧情 犯罪1298566,A Hard Day's Night, 喜剧 音乐1293590,A Streetcar Named Desire, 剧情1306016,"Dr. Mabuse, der Spieler", 悬疑 惊悚 犯罪1293782,Young Frankenstein, 喜剧 科幻1925768,Cabra Marcado Para Morrer, 纪录片1300055,Full Metal Jacket, 剧情 战争1299608,Scarface, 剧情 动作 犯罪 黑色电影1307177,I Walked with a Zombie, 恐怖1300352,Seven Chances, 喜剧 爱情 家庭1304447,Memento, 剧情 悬疑 惊悚 犯罪1293027,Passion, 剧情 喜剧1478064,Children of Men, 剧情 科幻 冒险 灾难1293448,2 Evil Dead II, 喜剧 恐怖1291990,Before Sunset, 剧情 爱情1291844,Terminator 2: Judgment Day, 动作 科幻1851857,The Dark Knight, 剧情 动作 科幻 惊悚 犯罪1293824,Rebecca, 剧情 爱情 悬疑1293073,The Fly, 科幻 恐怖2078989,"4 luni, 3 s", 剧情1295427,Der blaue Engel, 剧情 歌舞1295148,Bambi, 剧情 动画2567883,O Drag, 剧情 西部1292760,The Lady Vanishes, 喜剧 悬疑 惊悚1298412,The 39 Steps, 悬疑 惊悚 犯罪1462674,Szeg, 剧情 战争1297203,Possession, 剧情 恐怖1293047,A Place in the Sun, 剧情 爱情1293840,The Manchurian Candidate, 剧情 惊悚1301214,La belle noiseuse, 剧情 情色1962586,Xala, 喜剧1298655,Die Ehe der Maria Braun, 剧情1293321,Europa '51, 剧情1304862,Goodbye Dragon Inn, 剧情 喜剧1293499,Young Mr. Lincoln, 剧情 传记1307997,Blissfully Yours, 剧情 爱情1295835,Walkabout, 剧情 冒险1298951,They Live by Night, 爱情 犯罪 黑色电影1294413,After Life, 剧情1293213,Les diaboliques, 剧情 悬疑 惊悚 犯罪1418997,The African Queen, 剧情 爱情 战争 冒险1781126,Zodiac, 剧情 悬疑 惊悚 历史 犯罪2278780,Arrebato, 剧情 恐怖1301216,White Heat, 剧情 惊悚 犯罪 黑色电影1303358,Fat City, 剧情 运动1293276,Raising Arizona, 喜剧 悬疑 犯罪 冒险1304870,Mat i syn, 剧情1294720,Dazed and Confused, 剧情 喜剧1291562,Dancer in the Dark, 剧情 歌舞1294917,Monty Python and the Holy Grail, 喜剧 奇幻 冒险1297550,Great Expectations, 剧情 爱情1429098,Yeelen, 剧情1304920,Harakiri, 剧情1307921,Uzak, 剧情1299482,Foolish Wives, 剧情1292994,The Purple Rose of Cairo, 喜剧 爱情 奇幻1857095,Intimacy and Turbulence, 剧情1302186,Strike, 剧情1292722,Titanic, 剧情 爱情 灾难1421822,Titicut Follies, 剧情 纪录片2369090,By the Bluest of Seas, 剧情1302614,Gummo, 剧情1303520,Nouvelle vague, 剧情1872133,Still Life, 剧情 爱情1436690,Un chant d'amour, 短片 奇幻1325958,Breakfast at Tiffany's, 剧情 喜剧 爱情1292230,JFK, 剧情 悬疑 惊悚 传记 历史1303333,Y tu mam, 剧情 情色1301465,The Age of Innocence, 剧情 爱情1305611,The Wicker Man, 悬疑 恐怖1297127,Mr. Smith Goes to Washington, 剧情1292370,Edward Scissorhands, 剧情 爱情 奇幻1306548,Funny Games, 剧情 悬疑 惊悚 犯罪1300961,L'enfant sauvage, 剧情1292270,Requiem for a Dream, 剧情